{
  "$schema": "config_schema.json",
  "buildings": {
    "Hovel": {
      "cost": [
        "5",
        "0",
        "0",
        "0",
        "0"
      ]
    },
    "Woodcutter hut": {
      "health": "50"
    },
    "Iron mine": {
      "cost": [
        "20",
        "0",
        "0",
        "0",
        "0"
      ],
      "health": "300"
    },
    "Pitch rig": {
      "cost": [
        "20",
        "0",
        "0",
        "0",
        "0"
      ],
      "health": "150"
    },
    "Hunters hut": {
      "health": "50"
    },
    "Mercenary post": {
      "cost": [
        "0",
        "0",
        "0",
        "0",
        "50"
      ],
      "health": "150"
    },
    "Engineers guild": {
      "cost": [
        "10",
        "0",
        "0",
        "0",
        "50"
      ]
    },
    "Armory": {
      "health": "300"
    },
    "Fletcher": {
      "health": "400"
    },
    "Blacksmith": {
      "cost": [
        "20",
        "8",
        "2",
        "0",
        "0"
      ],
      "health": "400"
    },
    "Poleturner": {
      "cost": [
        "10",
        "4",
        "0",
        "0",
        "50"
      ]
    },
    "Armourer": {
      "cost": [
        "20",
        "16",
        "6",
        "0",
        "0"
      ],
      "health": "600"
    },
    "Tanner": {
      "cost": [
        "10",
        "0",
        "0",
        "0",
        "50"
      ],
      "health": "200"
    },
    "Bakery": {
      "cost": [
        "10",
        "2",
        "0",
        "0",
        "0"
      ],
      "health": "200"
    },
    "Brewery": {
      "cost": [
        "15",
        "0",
        "0",
        "0",
        "0"
      ],
      "health": "200"
    },
    "Inn": {
      "cost": [
        "15",
        "15",
        "0",
        "0",
        "0"
      ]
    },
    "Apothecary": {
      "cost": [
        "30",
        "0",
        "0",
        "0",
        "100"
      ],
      "health": "500"
    },
    "Tunnelers guild": {
      "cost": [
        "15",
        "0",
        "0",
        "0",
        "0"
      ],
      "health": "300"
    },
    "Marketplace": {
      "health": "1"
    },
    "Well": {
      "cost": [
        "0",
        "3",
        "0",
        "0",
        "0"
      ],
      "health": "200"
    },
    "Oil smelter": {
      "cost": [
        "0",
        "0",
        "1",
        "0",
        "0"
      ],
      "health": "500"
    },
    "Wheat farm": {
      "cost": [
        "15",
        "0",
        "0",
        "0",
        "20"
      ],
      "health": "200"
    },
    "Hop farm": {
      "cost": [
        "15",
        "0",
        "0",
        "0",
        "50"
      ],
      "health": "250"
    },
    "Apple farm": {
      "health": "50"
    },
    "Mill": {
      "health": "400"
    },
    "Stables": {
      "cost": [
        "50",
        "50",
        "0",
        "0",
        "500"
      ],
      "health": "800"
    },
    "Chapel": {
      "cost": [
        "0",
        "10",
        "0",
        "0",
        "50"
      ],
      "health": "300"
    },
    "Church": {
      "cost": [
        "0",
        "25",
        "0",
        "0",
        "100"
      ],
      "health": "1000"
    },
    "Cathedral": {
      "cost": [
        "0",
        "50",
        "0",
        "0",
        "500"
      ],
      "health": "2000"
    },
    "Keep two": {
      "housing": "8"
    },
    "Large gatehouse": {
      "cost": [
        "0",
        "25",
        "0",
        "0",
        "0"
      ],
      "health": "3000"
    },
    "Small gatehouse": {
      "cost": [
        "0",
        "15",
        "0",
        "0",
        "0"
      ],
      "health": "1500"
    },
    "Drawbridge": {
      "health": "100"
    },
    "Fire ballista": {
      "cost": [
        "0",
        "0",
        "0",
        "5",
        "120"
      ],
      "health": "600"
    },
    "Gallows": {
      "cost": [
        "20",
        "0",
        "1",
        "0",
        "0"
      ],
      "health": "75"
    },
    "Stocks": {
      "cost": [
        "15",
        "0",
        "0",
        "0",
        "45"
      ],
      "health": "50"
    },
    "Maypole": {
      "cost": [
        "15",
        "0",
        "0",
        "0",
        "15"
      ],
      "health": "50"
    },
    "Garden": {
      "cost": [
        "0",
        "5",
        "0",
        "0",
        "30"
      ],
      "health": "75"
    },
    "Killing pit": {
      "cost": [
        "5",
        "0",
        "0",
        "0",
        "0"
      ]
    },
    "Water pot": {
      "health": "300"
    },
    "Tower one": {
      "cost": [
        "0",
        "20",
        "0",
        "0",
        "0"
      ],
      "health": "500"
    },
    "Tower three": {
      "cost": [
        "0",
        "20",
        "0",
        "0",
        "0"
      ],
      "health": "2000"
    },
    "Tower four": {
      "cost": [
        "0",
        "40",
        "0",
        "0",
        "0"
      ],
      "health": "2000"
    },
    "Tower five": {
      "cost": [
        "0",
        "60",
        "0",
        "0",
        "0"
      ],
      "health": "3500"
    },
    "Catapult": {
      "cost": [
        "0",
        "15",
        "0",
        "0",
        "150"
      ],
      "health": "600"
    },
    "Trebuchet": {
      "cost": [
        "0",
        "20",
        "0",
        "0",
        "250"
      ],
      "health": "600"
    },
    "Siege tower": {
      "cost": [
        "30",
        "0",
        "0",
        "0",
        "0"
      ],
      "health": "600"
    },
    "Battering ram": {
      "cost": [
        "20",
        "0",
        "1",
        "0",
        "0"
      ],
      "health": "600"
    },
    "Portable shield": {
      "cost": [
        "3",
        "0",
        "0",
        "0",
        "0"
      ],
      "health": "600"
    },
    "Mangonel": {
      "cost": [
        "0",
        "0",
        "0",
        "0",
        "80"
      ]
    },
    "Tower Ballista": {
      "cost": [
        "0",
        "0",
        "0",
        "0",
        "80"
      ]
    },
    "Cesspit": {
      "cost": [
        "0",
        "0",
        "0",
        "0",
        "80"
      ],
      "health": "75"
    },
    "Burning stake": {
      "cost": [
        "10",
        "0",
        "0",
        "3",
        "0"
      ],
      "health": "75"
    },
    "Gibbet": {
      "cost": [
        "5",
        "0",
        "2",
        "0",
        "0"
      ],
      "health": "75"
    },
    "Dungeon": {
      "cost": [
        "0",
        "12",
        "0",
        "0",
        "0"
      ],
      "health": "150"
    },
    "Stretching rack": {
      "cost": [
        "0",
        "0",
        "2",
        "0",
        "10"
      ],
      "health": "50"
    },
    "Chopping block": {
      "cost": [
        "0",
        "6",
        "0",
        "0",
        "45"
      ]
    },
    "Dunking stool": {
      "cost": [
        "20",
        "0",
        "0",
        "0",
        "25"
      ],
      "health": "75"
    },
    "Dog cage": {
      "cost": [
        "10",
        "0",
        "0",
        "0",
        "50"
      ],
      "health": "300"
    },
    "Statue": {
      "cost": [
        "0",
        "10",
        "0",
        "0",
        "0"
      ],
      "health": "75"
    },
    "Shrine": {
      "cost": [
        "0",
        "10",
        "0",
        "0",
        "0"
      ],
      "health": "75"
    },
    "Dancing bear": {
      "cost": [
        "10",
        "0",
        "0",
        "0",
        "25"
      ],
      "health": "50"
    }
  },
  "resources": {
    "Wood": {
      "sell": "10"
    },
    "Hop": {
      "buy": "180",
      "sell": "90"
    },
    "Stone": {
      "buy": "60",
      "sell": "30"
    },
    "Iron": {
      "sell": "150",
      "baseDelivery": "2",
      "skirmishBonus": false
    },
    "Pitch": {
      "buy": "200",
      "sell": "80"
    },
    "Wheat": {
      "sell": "50"
    },
    "Cheese": {
      "buy": "60",
      "sell": "30"
    },
    "Meat": {
      "buy": "50",
      "sell": "25"
    },
    "Fruit": {
      "buy": "50",
      "sell": "25"
    },
    "Beer": {
      "buy": "300",
      "sell": "150"
    },
    "Flour": {
      "sell": "75"
    },
    "Bow": {
      "buy": "150",
      "sell": "90"
    },
    "Xbow": {
      "buy": "270"
    },
    "Spear": {
      "buy": "90",
      "sell": "45"
    },
    "Mace": {
      "buy": "300"
    },
    "Sword": {
      "buy": "330",
      "sell": "165"
    },
    "Leather": {
      "buy": "210"
    },
    "Armor": {
      "buy": "400",
      "sell": "200"
    }
  },
  "units": {
    "Tunneler": {
      "health": "15000",
      "arrowDamage": "3000",
      "xbowDamage": "10000",
      "stoneDamage": "800",
      "baseMeleeDamage": "100",
      "meleeDamageVs": {
        "Tunneler": "20",
        "European archer": "20",
        "European crossbowman": "20",
        "European spearman": "20",
        "European pikeman": "20",
        "European maceman": "20",
        "European swordsman": "10",
        "European knight": "10",
        "Ladderman": "20",
        "Engineer": "20",
        "Monk": "20",
        "unknown1": "20",
        "Catapult": "60",
        "Trebuchet": "60",
        "Mangonel": "60",
        "Lion": "20",
        "Rabbit": "20",
        "Camel": "20",
        "Lord": "20",
        "Siege tower": "60",
        "Battering ram": "60",
        "Portable shield": "60",
        "Tower ballista": "60",
        "Dog": "20",
        "unknown2": "20",
        "unknown3": "20",
        "Arabian archer": "20",
        "Arabian slave": "40",
        "Arabian slinger": "30",
        "Arabian assassin": "20",
        "Arabian horse archer": "20",
        "Arabian swordsman": "20",
        "Arabian firethrower": "20",
        "Fire ballista": "60"
      }
    },
    "European crossbowman": {
      "health": "17500",
      "arrowDamage": "1400",
      "stoneDamage": "800",
      "baseMeleeDamage": "20",
      "meleeDamageVs": {